{
  "$schema": "../../taxonomy/claims.schema.json",
  "name": "Helicone",
  "url": "https://www.helicone.ai/",
  "category": "MCPGateway",
  "positioning": "Open-source LLM gateway and observability platform.",
  "capabilities": ["params_allowlist"],
  "claims": ["observability", "open_source"],
  "pricing_signals": "oss|tiers",
  "customers_mentioned": [],
  "evidence": [
    {"type": "url", "href": "https://docs.helicone.ai/"},
    {"type": "url", "href": "https://docs.helicone.ai/introduction/why-helicone"},
    {"type": "url", "href": "https://docs.helicone.ai/features/overview"}
  ],
  "gapsVsEmpowerNow": ["no_plan_jws", "no_schema_pins", "no_receipt_chain", "no_budget_enforcement_402"],
  "traps_counters": {"trap": "Observability equals governance", "counter": "Enforcement requires plan/pins + budgets + receipts to stop off‑plan calls"},
  "lastFetched": "2025-09-26",
  "stalenessDays": 60,
  "notes": "OSS gateway; confirm any request‑blocking features in POC"
}


